{"item_id":"we-v2.1.2-live-T091038Z-005","section":"Written Expression","agent_version":"Written Expression Reviewer v2.0","verdict":"PASS","critical_failure":false,"independent_answer":"C","grammar_validity":"PASS","format_validity":"PASS","detected_error_count":1,"detected_error_position":"C","non_error_parts_valid":true,"minimal_correction_valid":true,"marked_part_assessments":{"A":"ACCEPTABLE","B":"ACCEPTABLE","C":"ERROR","D":"ACCEPTABLE"},"checks":{"grammar_validity":"PASS","one_error_only":"PASS","answer_uniqueness":"PASS","format_validity":"PASS","target_metadata":"AMBIGUOUS","naturalness":"PASS","provenance":"PASS"},"format_diagnostics":null,"issues":[],"revision_requirements":[],"source_similarity_risk":"LOW","provenance":{"agent_version":"Written Expression Reviewer v2.0","prompt_hash":null,"spec_version":"v2.0","format_spec_version":"unknown","review_batch_id":"we-v2.1.2-live-T091038Z-005","item_review_order":1,"invocation_id":null,"runtime_model":null}}