{"item_id":"we-v2.1.2-live-T091038Z-003","section":"Written Expression","agent_version":"Written Expression Reviewer v2.0","verdict":"REJECT","critical_failure":true,"independent_answer":"NONE","grammar_validity":"FAIL","format_validity":"WARN","detected_error_count":0,"detected_error_position":"NONE","non_error_parts_valid":true,"minimal_correction_valid":false,"marked_part_assessments":{"A":"ACCEPTABLE","B":"ACCEPTABLE","C":"ACCEPTABLE","D":"ACCEPTABLE"},"checks":{"grammar_validity":"FAIL","one_error_only":"FAIL","answer_uniqueness":"PASS","format_validity":"WARN","target_metadata":"AMBIGUOUS","naturalness":"PASS","provenance":"WARN"},"format_diagnostics":null,"issues":[{"severity":"CRITICAL","category":"zero_genuine_errors","description":"The sentence is grammatically correct; no marked part contains a genuine grammatical error."}],"revision_requirements":["Introduce exactly one genuine grammatical error and mark its location with one of A-D, or revise the item as an intentional NONE case if the format permits."],"source_similarity_risk":"LOW","provenance":{"agent_version":"Written Expression Reviewer v2.0","prompt_hash":null,"spec_version":"v2.0","format_spec_version":"unknown","review_batch_id":"live-blinded-review","item_review_order":1,"invocation_id":null,"runtime_model":null}}