{"item_id":"we-v2.1.2-live-T083657Z-003","section":"Written Expression","agent_version":"Written Expression Reviewer v2.0","verdict":"PASS","critical_failure":false,"independent_answer":"B","grammar_validity":"PASS","format_validity":"PASS","detected_error_count":1,"detected_error_position":"B","non_error_parts_valid":true,"minimal_correction_valid":true,"marked_part_assessments":{"A":"ACCEPTABLE","B":"ERROR","C":"ACCEPTABLE","D":"ACCEPTABLE"},"checks":{"grammar_validity":"PASS","one_error_only":"PASS","answer_uniqueness":"PASS","format_validity":"PASS","target_metadata":"AMBIGUOUS","naturalness":"PASS","provenance":"WARN"},"format_diagnostics":null,"issues":[{"severity":"MINOR","category":"subject-verb agreement","description":"The singular subject “The sequence” requires “reveals,” not “reveal.”"}],"revision_requirements":[],"source_similarity_risk":"LOW","provenance":{"agent_version":"Written Expression Reviewer v2.0","prompt_hash":null,"spec_version":"toefl-itp-we-reviewer-v2.0","format_spec_version":"toefl_itp_we_format_spec_addendum.json","review_batch_id":"live-blinded","item_review_order":1,"invocation_id":null,"runtime_model":null}}