{"item_id":"we-v2.1.2-live-T082350Z-001","section":"Written Expression","agent_version":"Written Expression Reviewer v2.0","verdict":"REJECT","critical_failure":true,"independent_answer":"AMBIGUOUS","grammar_validity":"AMBIGUOUS","format_validity":"PASS","detected_error_count":1,"detected_error_position":"B","non_error_parts_valid":true,"minimal_correction_valid":true,"marked_part_assessments":{"A":"MARGINAL","B":"ERROR","C":"ACCEPTABLE","D":"ACCEPTABLE"},"checks":{"grammar_validity":"AMBIGUOUS","one_error_only":"AMBIGUOUS","answer_uniqueness":"FAIL","format_validity":"PASS","target_metadata":"AMBIGUOUS","naturalness":"PASS","provenance":"WARN"},"format_diagnostics":null,"issues":[{"severity":"CRITICAL","category":"answer_uniqueness","description":"The singular subject concentration requires varies at B, but changing concentration to concentrations at A also produces a grammatical sentence, creating an alternate repair and ambiguous answer location."}],"revision_requirements":["Redesign the target so only one marked part permits a valid minimal repair; eliminate the subject-number alternative at A or revise the sentence structure."],"source_similarity_risk":"LOW","provenance":{"agent_version":"Written Expression Reviewer v2.0","prompt_hash":null,"spec_version":"v2.0","format_spec_version":"not_provided","review_batch_id":"we-v2.1.2-live-T082350Z-001","item_review_order":1,"invocation_id":null,"runtime_model":null}}